Set	Num	Name	Rarity	Type	House	Traits	Æ	Power	Armor	Abilities	Flavor	Artist	Image	Complete	In Decks
CotA	001	Anger	C	Action	Brobnar		1			Play: Ready and fight with a friendly creature. (That creature may be from any house.)	"Don't make them angry you say? Heh. The Brobnar are born angry." -- Old Bruno	Melvin Chan	https://cdn.discordapp.com/attachments/475148937754312719/475155021034553354/image.jpg	0	32
CotA	002	Barehanded	R	Action	Brobnar		1			Play: Put each artifact on top of its owner's deck.		Michele Giorgi	https://cdn.discordapp.com/attachments/475148937754312719/478655474061803541/CameraZOOM-20180813160207057.jpg	0	2
CotA	003	Blood Money	U	Action	Brobnar		0			Play: Place 2[Æ] from the common supply on an enemy creature.	"You!  Æmber lover.  You're next."	Gong Studios	https://cdn.discordapp.com/attachments/475148937754312719/477165525097512961/image.jpg	0	8
CotA	004	Brothers in Battle	R	Action	Brobnar		1			Play: Choose a creature. For the remainder of the turn, each friendly creature of that house can fight.		Rodrigo Camilo	https://cdn.discordapp.com/attachments/475148937754312719/478655488750387230/CameraZOOM-20180813160156436.jpg	0	3
CotA	005	Burn the Stockpile	U	Action	Brobnar		0			Play: If your opponent has 7[Æ] or more, they lose 4[Æ].	"If you can't protect it, you don't deserve it." -- Bigum Avalanche	BalanceSheet	https://cdn.discordapp.com/attachments/475148937754312719/478655524448239627/CameraZOOM-20180813160144719.jpg	0	12
CotA	006	Champion's Challenge	R	Action	Brobnar		0			Play: Destroy each enemy creature except the most powerful enemy creature. Destroy each friendly creature except the most powerful friendly creature. Ready and fight with your remaining creature.		Matthew Mizak	https://cdn.discordapp.com/attachments/475148937754312719/482741432138989569/40051746_10216942466624521_943245749586493440_n.jpg	0	2
CotA	007	Coward's End	C	Action	Brobnar		0			Play: Destroy each undamaged creature.  Gain 3 chains.		Timur Shevtsov	https://cdn.discordapp.com/attachments/475148937754312719/475155021034553354/image.jpg	0	30
CotA	008	Follow the Leader	U	Action	Brobnar		0			Play: For the remainder of the turn, each friendly creature may fight.		Bogdan Tauciuc	https://cdn.discordapp.com/attachments/475148937754312719/475155021034553354/image.jpg	0	9
CotA	009	Lava Ball	R	Action	Brobnar		0			Play: Deal 4[D] to a creature with 2[D] splash.	"Here...Catch!"	Quentin de Warren	https://cdn.discordapp.com/attachments/475148937754312719/477165523948273674/image.jpg	0	3
CotA	010	Loot the Bodies	C	Action	Brobnar		0			Play: For the remainder of the turn, gain 1[Æ] each time an enemy creature is destroyed.	"Loot the Bodies! Hit the Floor! Loot the Bodies! Hit the Floor!" -- Brobnar War Chant	Grigory Serov	https://cdn.discordapp.com/attachments/475148937754312719/475155021034553354/image.jpg	0	34
CotA	011	Take that, Smartypants	R	Action	Brobnar		1			Play: Steal 2[Æ] if your opponent has 3 or more Logos cards in play.	"Them bots don't wear pants.  I carry spares."	Caravan Studio	https://cdn.discordapp.com/attachments/475148937754312719/489498009810501632/20180912_200409.jpg	0	1
CotA	012	Punch	C	Action	Brobnar		1			Play: Deal 3[D] to a creature.	Three for flinching.	Ivan Tao	https://drive.google.com/file/d/1VYxN8tYef5EKT_6IAzHYyYd5RZOcKDNl/view?usp=drivesdk	0	22
CotA	013	Relentless Assault	U	Action	Brobnar		0			Play: Ready and fight with up to 3 different friendly creatures, one at a time		Jordan Kerbow	https://cdn.discordapp.com/attachments/475148937754312719/488846922057121792/image0.jpg	0	12
CotA	014	Smith	U	Action	Brobnar		1			Play: Gain 2[Æ] if you control more creatures than your opponent.		Gabriel Rubio	https://cdn.discordapp.com/attachments/475148937754312719/482675109040095253/5.jpg	0	7
CotA	015	Sound the Horns	U	Action	Brobnar		1			Play: Discard cards from the top of your deck until you either discard a Brobnar creature or run out of cards. If you discarded a Brobnar creature this way, put it into your hand.		Albert Bruun	https://cdn.discordapp.com/attachments/484154914038087680/486950726606520330/image0.jpg	0	8
CotA	016	Tremor	C	Action	Brobnar		0			Play: Stun a creature and each of its neighbors.		Oscar Romer	https://drive.google.com/file/d/1VYxN8tYef5EKT_6IAzHYyYd5RZOcKDNl/view?usp=drivesdk	0	22
CotA	017	Unguarded Camp	U	Action	Brobnar		1			Play: For each creature you have in excess of your opponent, a friendly creature captures 1[Æ].  Each creature cannot capture more than 1[Æ] this way.		Jon Bosco	https://cdn.discordapp.com/attachments/484154914038087680/486950623670042624/image0.jpg	0	13
CotA	018	Warsong	C	Action	Brobnar		0			Play: For the remainder of the turn, gain 1[Æ] each time a friendly creature fights.		Monztre	https://www.facebook.com/photo.php?fbid=1651197051658150&set=oa.505644606563646&type=3&theater	0	38
CotA	019	Autocannon	R	Artifact	Brobnar	Weapon	1			Deal 1[D] to each creature after it enters play.		Moh Mükhtar	https://cdn.discordapp.com/attachments/475148937754312719/482181505087700992/IMG_20180823_093624.jpg	0	4
CotA	020	Banner of Battle	R	Artifact	Brobnar	Item	0			Each friendly creature gets +1 power.		Caravan Studio	https://cdn.discordapp.com/attachments/475148937754312719/490021908180500490/image0.jpg	0	0
CotA	021	Cannon	U	Artifact	Brobnar	Weapon	0			Action: Deal 2[D] to a creature.		Konstantin Turovec	http://aembertree.com/cards/core-021.jpg	0	10
CotA	022	Gauntlet of Command	C	Artifact	Brobnar	Item	0			Action: Ready and Fight with a friendly creature.	"I said 'take me to your leader' and got a fist to the face." -- Captain Val Jericho	Eric Kenji Aoyagi	https://cdn.discordapp.com/attachments/475148937754312719/475155021034553354/image.jpg	0	20
CotA	023	Iron Obelisk	R	Artifact	Brobnar	Location	0			Your opponent's keys cost +1[Æ] for each friendly damaged Brobnar creature.		Andrew Bosley	https://drive.google.com/file/d/1VYxN8tYef5EKT_6IAzHYyYd5RZOcKDNl/view?usp=drivesdk	0	5
CotA	024	Mighty Javelin	U	Artifact	Brobnar	Weapon	1			Omni: Sacrifice Mighty Javelin. Deal 4[D] to a creature.		Limetown Studios	https://cdn.discordapp.com/attachments/475148937754312719/478655379652476928/CameraZOOM-20180813155740813.jpg	0	12
CotA	025	Pile of Skulls	R	Artifact	Brobnar	Location	0			Each time an enemy creature is destroyed during your turn, a friendly creature captures 1[Æ].		Caravan Studio	https://cdn.discordapp.com/attachments/475148937754312719/483000611747659786/image0.jpg	0	6
CotA	026	Screechbomb	U	Artifact	Brobnar	Weapon	0			Omni: Sacrifice Screechbomb. Your opponent loses 2[Æ].	"I think that thing made me deaf!" "What?  I can't hear you!  I think that thing made me deaf!"	Albert Bruun	https://scontent-iad3-1.xx.fbcdn.net/v/t1.0-9/41395076_10212574011652373_7273110430933843968_n.jpg?_nc_cat=0&oh=7f2833eb46188a6566cecba79e092484&oe=5C20212E	0	10
CotA	027	The Warchest	U	Artifact	Brobnar	Item	0			Action: Gain 1[Æ] for each enemy creature that was destroyed in a fight this turn.	It doesn't matter what the treasure is, only how it was won.	Caravan Studio	https://www.facebook.com/photo.php?fbid=1651253274985861&set=oa.505644606563646&type=3&theater	0	14
CotA	028	Bilgum Avalanche	R	Creature	Brobnar	Giant	0	5	~	After you forge a key, deal 2[D] to each enemy creature.	"Some call her 'warleader.'  Some call her 'demon.'  I just call her 'avalanche.'" -- Dodger	Konstantin Turovec	https://www.facebook.com/photo.php?fbid=10216821061337645&set=p.10216821061337645&type=3&theater&ifg=1	0	4
CotA	029	Valdr	C	Creature	Brobnar	Giant	0	6	~	Valdr deals +2[D] while attacking an enemy creature on the flank.  (The flank is either end of a player's battleline.)	"Gather that Æmber!  And you're welcome."	Caio Monteiro	https://www.facebook.com/photo.php?fbid=1651196611658194&set=oa.505644606563646&type=3&theater	0	38
CotA	030	Bumpsy	C	Creature	Brobnar	Giant	0	5	~	Play: Your opponent loses 1[Æ]	Whatever he doesn't like, he breaks.  He doesn't like anything.	Grigory Serov	https://pbs.twimg.com/media/Dj9nlW0X4AAViZZ.jpg	0	38
CotA	031	Earthshaker	U	Creature	Brobnar	Giant	0	7	~	Play: Destroy each creature with power 3 or lower.	"Did you feel that?"	Monztre	https://cdn.discordapp.com/attachments/475148937754312719/482231722520477707/IMG_20180823_122622.jpg	0	11
CotA	032	Firespitter	C	Creature	Brobnar	Giant	0	5	1	Before Fight: Deal 1[D] to each enemy creature.	Guess how he got that name.	Nicola Saviori	https://www.facebook.com/photo.php?fbid=1651253018319220&set=oa.505644606563646&type=3&theater	0	30
CotA	033	Ganger Chieftain	C	Creature	Brobnar	Giant	0	5	~	Play: You may ready and fight with a neighboring creature. (That creature may be from any house.)	It takes two to fight, but more is better.	Forrest Imel	https://www.facebook.com/photo.php?fbid=1651196918324830&set=oa.505644606563646&type=3&theater	0	27
CotA	034	Grenade Snib	U	Creature	Brobnar	Goblin	0	2	~	Destroyed: You opponent loses 2[Æ].		Taylor Ingvarsson	https://cdn.discordapp.com/attachments/475148937754312719/478655568605872129/CameraZOOM-20180813155813482.jpg	0	9
CotA	035	Headhunter	C	Creature	Brobnar	Giant	0	5	~	Fight: Gain 1[Æ].	"I mean, I think it's a head..."	Nicola Saviori	https://www.facebook.com/photo.php?fbid=1651196901658165&set=oa.505644606563646&type=3&theater	0	18
CotA	036	Hebe the Huge	U	Creature	Brobnar	Giant * Knight	0	6	~	Play: Deal 2[D] to each other undamaged creature.	He's much bigger in person.	Eric Kenji Aoyagi	https://drive.google.com/file/d/1HxaRxnhwTdL3GUbCb8BaPDEANvwqzaTe/view?usp=drivesdk	0	9
CotA	037	Kelifi Dragon	R	Creature	Brobnar	Dragon	0	12	~	Kelifi Dragon cannot be played unless you have 7[Æ] or more. Fight/Reap:  Gain 1[Æ].  Deal 5[D] to a creature.		Caio Monteiro	https://cdn.discordapp.com/attachments/475148937754312719/475155021034553354/image.jpg	0	3
CotA	038	King of the Crag	R	Creature	Brobnar	Giant	0	7	~	Each enemy Brobnar creature gets -2 power.	Overthrowing the king is an uphill battle.	Melvin Chan	https://cdn.discordapp.com/attachments/475148937754312719/477566512832708640/King_of_the_Crag.png	0	5
CotA	039	Krump	C	Creature	Brobnar	Giant	0	6	~	After an enemy creature is destroyed fighting Krump, its controller loses 1[Æ]		Brolkin	https://drive.google.com/file/d/1HxaRxnhwTdL3GUbCb8BaPDEANvwqzaTe/view?usp=drivesdk	0	25
CotA	040	Lomir Flamefist	U	Creature	Brobnar	Giant	0	5	~	Play: If your opponent has 7[Æ] or more, they lose 2[Æ].	"I thought his name would turn out to be... metaphorical." - Quixo the "Adventurer"	David Kegg	https://cdn.discordapp.com/attachments/475148937754312719/483059255411474467/IMG_20180825_163628492_HDR.jpg	0	9
CotA	041	Looter Goblin	R	Creature	Brobnar	Goblin	0	2	~	Elusive.  (The first time this creature is attacked each turn, no damage is dealt.) Reap: Fir the remainder of the turn, gain 1[Æ] each time an enemy creature is destroyed.		Rodrigo Camilo	https://cdn.discordapp.com/attachments/475148937754312719/477608280957517839/IMG_20180810_184435.jpg	0	5
CotA	042	Mugwump	R	Creature	Brobnar	Giant	0	6	~	After an enemy creature is destroyed fighting Mugwump, fully heal Mugwump and give it a +1 power counter.		Nicholas Gregory	https://cdn.discordapp.com/attachments/475148937754312719/479483002053853184/DSC_0227.jpg	0	2
CotA	043	Pingle Who Annoys	R	Creature	Brobnar	Goblin	0	2	~	Elusive.  (The first time this creature is attacked each turn, no damage is dealt.) Deal 1[D] to each enemy creature after it enters play.		Rodrigo Camilo	https://cdn.discordapp.com/attachments/475148937754312719/477607390079090688/IMG_20180810_175526.jpg	0	2
CotA	044	Rock-Hurling Giant	R	Creature	Brobnar	Giant	0	6	~	During your turn, each time you discard a Brobnar card from your hand, you may deal 4[D]   a creature.		Caio Monteiro	https://www.facebook.com/photo.php?fbid=310155609556996&set=pcb.512245889236851&type=3&theater&ifg=1	0	4
CotA	045	Rogue Ogre	R	Creature	Brobnar	Giant * Mutant	0	6	~	At the end of your turn, if you played exactly one card this turn, Rogue Ogre heals 2 damage and captures 1[Æ].	"I like to think of it as a Roguere." -- Dodger	Caio Monteiro	https://cdn.discordapp.com/attachments/475148937754312719/488067030294069248/image0.jpg	0	1
CotA	046	Smaaash	C	Creature	Brobnar	Giant	0	5	~	Play: Stun a creature.	"I'm not sure he knows any other words."	Bogdan Tauciuc	https://cdn.discordapp.com/attachments/475148937754312719/475155021034553354/image.jpg	0	34
CotA	047	Tireless Crocag	R	Creature	Brobnar	Giant	0	7	~	Tireless Crocag cannot reap. You may use Tireless Crocag as if it belonged to the active house. If your opponent has no creatures in play, Destroy Tireless Crocag.		Gabriel Rubio	https://cdn.discordapp.com/attachments/475148937754312719/482741432138989569/40051746_10216942466624521_943245749586493440_n.jpg	0	3
CotA	048	Troll	C	Creature	Brobnar	Giant	0	8	~	Reap: Troll heals 3 damage.	Don't feed it, it'll go away.	Timur Shevtsov	https://www.facebook.com/photo.php?fbid=1651253021652553&set=oa.505644606563646&type=3&theater	0	32
CotA	049	Wardrummer	C	Creature	Brobnar	Goblin	0	3	~	Play: Return each other friendly Brobnar creature to your hand.		Nicola Saviori	https://cdn.discordapp.com/attachments/475148937754312719/475155021034553354/image.jpg	0	25
CotA	050	Blood of Titans	U	Upgrade	Brobnar		1			This creature gets +5 power.	"Blood of Giants? Why stop there?" -- Pingle Who Annoys	Ivan Tao	https://cdn.discordapp.com/attachments/475148937754312719/478655550725292032/CameraZOOM-20180813160136047.jpg	0	18
CotA	051	Phoenix Heart	R	Upgrade	Brobnar		0			This creature gains, "Destroyed: Return this creature to it's owner's hand and deal 3[D] to each creature in play.		Caravan Studio	https://www.facebook.com/photo.php?fbid=310155609556996&set=pcb.512245889236851&type=3&theater&ifg=1	0	2
CotA	052	Yo Mama Mastery	R	Upgrade	Brobnar		1			This creature gains Taunt. Play: Fully heal this creature	"Yo' mama is so tiny..."	Caravan Studio	https://cdn.discordapp.com/attachments/475148937754312719/483000647130546178/image0.jpg	0	4
CotA	053	A Fair Game	R	Action	Dis		0			Play: Discard the top card or your opponent's deck and reveal their hand. You gain 1[Æ] for each card of the discarded card's house revealed in this way. Your opponent repeats the preceeding effect on you.			https://cdn.discordapp.com/attachments/475148937754312719/483669566195630103/A_Fair_Game.jpg	0.1	3
CotA	054	Arise!	C	Action	Dis		0			Play: Choose a house.  Return each creature of that house from your discard pile to your hand.  Gain 1 chain.		David Kegg	https://cdn.discordapp.com/attachments/475148937754312719/475727172213014539/IMG_20180805_103930-01.jpg	0	47
CotA	055	Control the Weak	C	Action	Dis		1			Play: Choose a house on your opponent's identity card. Your opponent must choose that house as their active house next turn.		Gong Studios	https://drive.google.com/file/d/1OX381Tz3CZbOF0VccVlC1JCWvF9ne8x2/view?usp=drivesdk	0	37
CotA	056	Creeping Oblivion	R	Action	Dis		1			Play: Purge up to 2 cards from a discard pile.	"As far as oblivions go, it's in my bottom three." -- Dr. Escotera.	Andrew Bosley	https://cdn.discordapp.com/attachments/475148937754312719/482500180675919872/39986160_10217012551775907_7565255751380238336_n.jpg	0	2
CotA	057	Dance of Doom	R	Action	Dis		0			Play: Choose a number.  Destroy each creature with power equal to that number.		Mihai Radu	https://www.facebook.com/photo.php?fbid=310151816224042&set=pcb.512241152570658&type=3&theater&ifg=1	0	10
CotA	058	Fear	C	Action	Dis		0			Play: Return an enemy creature to its owner's hand.		Nicholas Gregory	https://cdn.discordapp.com/attachments/475148937754312719/479410359153852426/20180815_145533.jpg	0	35
CotA	059	Gateway to Dis	C	Action	Dis		0			Play: Destroy each creature.  Gain 3 chains.		Brolkin	https://images-cdn.fantasyflightgames.com/filer_public/ef/68/ef68b13a-225c-48dc-94e6-2ec2c8396dd5/kf01_card_gateway-to-dis.png	0	36
CotA	060	Gongoozle	U	Action	Dis		1			Play: Deal 3[D] to a creature.  If it is not destroyed, its owner discards a random card from their hand.	"Just trying to understand these...'things' gives me a headache."	Bogdan Tauciuc	https://i.imgur.com/9xQIWYM.jpg	0	10
CotA	061	Guilty Hearts	R	Action	Dis		1			Play: Destroy each creature with any [Æ] on it.	C'mon, take it.  You know you want to.	Grigory Serov	https://i.imgur.com/NIFF1vC.jpg	0	2
CotA	062	Hand of Dis	C	Action	Dis		0			Play: Destroy a creature that is not on a flank.	"Let me give you a hand..."	Mariusz Gandzel	https://cdn.discordapp.com/attachments/475148937754312719/475155021034553354/image.jpg	0	29
CotA	063	Hectacomb	R	Action	Dis		1			Play: Destroy each Dis creature.  Each player gains 1[Æ] for each creature they controlled that was destroyed this way.		Mariusz Gandzel	https://cdn.discordapp.com/attachments/475148937754312719/479438589361651712/hectabomb.png	0	3
CotA	064	Tendrils of Pain	U	Action	Dis		1			Play:  Deal 1[D] to each creature.  Deal an additional 3[D] to each creature if your opponent forged a key on their previous turn.		Timur Shevtsov	https://cdn.discordapp.com/attachments/475148937754312719/478655509533163521/CameraZOOM-20180813160121825.jpg	0	12
CotA	065	Hysteria	U	Action	Dis		0			Play: Return each creature to its owner's hand.	"Help, I can't stop this feeling!"	Gong Studios	https://cdn.discordapp.com/attachments/475148937754312719/475727172213014539/IMG_20180805_103930-01.jpg	0	10
CotA	066	Key Hammer	U	Action	Dis		1			Play: If your opponent forged a key on their previous turn, unforge it. Your opponent gains 6[Æ].	What time is it?	Caravan Studio	https://cdn.discordapp.com/attachments/475148937754312719/476943073348288522/20180808_202031.jpg	0	21
CotA	067	Mind Barb	C	Action	Dis		1			Play: Your opponent discards a random card from their hand.		Grigory Serov	https://cdn.discordapp.com/attachments/475148937754312719/475155021034553354/image.jpg	0	30
CotA	068	Pandemonium	U	Action	Dis		1			Play: Each undamaged creature captures 1[Æ] from its opponent.		Caravan Studio	https://cdn.discordapp.com/attachments/475148937754312719/483059297157382144/IMG_20180825_163724598_HDR.jpg	0	12
CotA	069	Poltergeist	U	Action	Dis		1			Play: Use an artifact controlled by any player as if it were yours. Destroy that artifact.		Andrew Bosley	https://cdn.discordapp.com/attachments/475148937754312719/476943073348288522/20180808_202031.jpg	0	11
CotA	070	Red Hot Armor	R	Action	Dis		1			Play: Each enemy creature with armor loses all of its armor until the end of the turn and is dealt 1[D] for each point of armor lost this way.		Caravan Studio	https://cdn.discordapp.com/attachments/475148937754312719/480121341014704129/39403778_1866501063428904_4062952939331780608_n.jpg	0	5
CotA	071	Three Fates	U	Action	Dis		1			Play: Destroy the 3 most powerful creatures.	"Destitution, Dereliction, and Defenestration."	Andreas Zafiratos	https://drive.google.com/file/d/1OX381Tz3CZbOF0VccVlC1JCWvF9ne8x2/view?usp=drivesdk	0	13
CotA	072	Annihilation Ritual	R	Artifact	Dis	Power	1			When a creature would enter a discard pile from play, it is purged instead.		Andreas Zafiratos	https://i.imgur.com/R1qOKNt.jpg	0	3
CotA	073	Dominator Bubble	C	Artifact	Dis	Item	0			Action: Use a friendly creature.	"I know I shouldn't'a nicket it, but 'twere so ... shiny." -- Noddy the Thief	Caravan Studio	https://www.facebook.com/photo.php?fbid=1651253094985879&set=oa.505644606563646&type=3&theater	0	34
CotA	074	Key to Dis	R	Artifact	Dis	Item	0			Omni: Sacrifice Key to Dis. Destroy each creature.		Grigory Serov	https://cdn.discordapp.com/attachments/475148937754312719/475727172213014539/IMG_20180805_103930-01.jpg	0	6
CotA	075	Lash of Broken Dreams	C	Artifact	Dis	Weapon	0			Action: Keys cost +3[Æ] during your opponent's next turn.	"At first, I thought that nothing could harm an Archon." -- Captain Val Jericho	David Auden Nash	https://www.facebook.com/photo.php?fbid=1651253198319202&set=oa.505644606563646&type=3&theater	0	41
CotA	076	Library of the Damned	U	Artifact	Dis	Location	0			Action: Archive a card.	"This place takes the idea of losing yourself in a boot to a whole new level." -- Doc Bockton	Jacob Altemza	https://cdn.discordapp.com/attachments/475148937754312719/479438618566328325/librarydamned.png	0	8
CotA	077	Lifeward	U	Artifact	Dis	Power	1			Omni: Sacrifice Lifeward.  You opponent cannot play creatures on their next turn.		Caravan Studio	https://cdn.discordapp.com/attachments/475148937754312719/480493092223582208/lifeward.png	0	12
CotA	078	Sacrificial Altar	R	Artifact	Dis	Location	1			Action: Purge a friendly Human creature from play.  If you do, play a creature from your discard pile.		Gong Studios	https://cdn.discordapp.com/attachments/475148937754312719/479410288190291980/20180815_145600.jpg	0	4
CotA	079	Screaming Cave	R	Artifact	Dis	Location	0			Action: Shuffle your hand and discard pile into your deck.	"Was that you, or the cave?" -- Captain Val Jericho	Gong Studios	https://cdn.discordapp.com/attachments/475148937754312719/481886003725074442/39821870_10155811212236375_4107532092819111936_n.png	0	3
CotA	080	Soul Snatcher	R	Artifact	Dis	Vehicle	0			Each time a creature is destroyed, its owner gains 1[Æ].	No one goes in, no one comes out.  And yet the fires burn.	Mark Bulahao	https://cdn.discordapp.com/attachments/475148937754312719/481619039529992192/Soul_Snatcher.jpg	0	5
CotA	081	Charette	C	Creature	Dis	Demon	0	4	~	Play: Capture 3[Æ].	It doesn't like to share.	Josh Corpuz	https://cdn.discordapp.com/attachments/475148937754312719/480826770740871189/IMG_0346.JPG	0	33
CotA	082	Drumble	U	Creature	Dis	Imp	0	2	~	Elusive.  (The first time this creature is attacked each turn, no damage is dealt.) Play:  If your opponent has 7[Æ] or more, capture all of it.		Mariusz Gandzel	https://scontent-iad3-1.xx.fbcdn.net/v/t1.0-9/41436399_10212574017492519_7639025246367907840_n.jpg?_nc_cat=0&oh=de903fcd48c5c975e60da274ad4b9814&oe=5C376DBE	0	11
CotA	083	Dust Imp	C	Creature	Dis	Imp	0	2	~	Destroyed: Gain 2[Æ].	When the demon's away, the imps will play.	Grigory Serov	https://cdn.discordapp.com/attachments/475148937754312719/475155021034553354/image.jpg	0	35
CotA	084	Eater of the Dead	R	Creature	Dis	Demon	0	4	~	Fight/Reap: Purge a creature from a discard pile.  If you do, put a +1 power counter on Eater of the Dead.		Jacob Altemza	https://cdn.discordapp.com/attachments/475148937754312719/479410099505594399/20180815_145615.jpg	0	6
CotA	085	Ember Imp	C	Creature	Dis	Imp	0	2	~	Your opponent may not play more than 2 cards each turn		Gong Studios	https://drive.google.com/file/d/1OX381Tz3CZbOF0VccVlC1JCWvF9ne8x2/view?usp=drivesdk	0	33
CotA	086	Gabos Longarms	R	Creature	Dis	Demon	0	5	~	Before Fight: Choose a creature. Gabos Longarms deals damage to that creature rather than the one it is fighting.		Michele Giorgi	https://i.imgur.com/Z23piiW.jpg	0	5
CotA	087	Overlord Greking	R	Creature	Dis	Demon	0	7	~	After an enemy creature is destroyed fighting Overlord Greking, put that creature into play under your control.		Ilya Bondarenko	https://cdn.discordapp.com/attachments/475148937754312719/483670279554334720/FB_IMG_1535386364646.jpg	0	1
CotA	088	Guardian Demon	U	Creature	Dis	Demon	0	4	~	Play/Fight/Reap:  Heal up to 2 damage from a creature.  Deal that amount of damage to another creature.		Forrest Imel	https://i.imgur.com/S9s54C8.jpg	0	13
CotA	089	Master of 1	R	Creature	Dis	Demon	0	4	~	Reap: You may destroy a creature with 1 power.	The first sin is fear.	Mihai Radu	https://cdn.discordapp.com/attachments/475148937754312719/482571425291698176/40002095_10156275197226293_3964710312669609984_n.jpg	0	0
CotA	090	Master of 2	S	Creature	Dis	Demon	0	4	~	Reap: You may destroy a creature with 2 power.	The second sin is apathy.	Mihai Radu	https://cdn.discordapp.com/attachments/475148937754312719/482571425291698176/40002095_10156275197226293_3964710312669609984_n.jpg	0	1
CotA	091	Master of 3	S	Creature	Dis	Demon	0	4	~	Reap: You may destroy a creature with 3 power.	The third sin is greed.	Mihai Radu	https://cdn.discordapp.com/attachments/475148937754312719/477106817902706688/FB_IMG_1533821262101.jpg	0	2
CotA	092	Pit Demon	C	Creature	Dis	Demon	0	5	~	Action: Steal 1[Æ].	They come from another world, they are pure evil made flesh and steel, and the lurk in the darkest corners of the land.  Yes, I'm comfortable calling them 'demons'" -- Science Officer Wu	Nicola Saviori	https://drive.google.com/file/d/1OX381Tz3CZbOF0VccVlC1JCWvF9ne8x2/view?usp=drivesdk	0	30
CotA	093	Pitlord	R	Creature	Dis	Demon	2	9	~	Taunt (This creature's neighbors cannot be attacked unless they have taunt.) While Pitlord is in play, you must choose Dis as your active house.		Asep Ariyanto	https://drive.google.com/file/d/1eLDxk4bQn-wxNFLHh7jGl4LUmlzzG-Pl/view?usp=drivesdk	0	5
CotA	094	Restringuntus	R	Creature	Dis	Demon	0	1	~	Play:  Choose a house.  Your opponent cannot choose that house as their active house until Restringuntus leaves play.		Timur Shevtsov	https://cdn.discordapp.com/attachments/475148937754312719/476943073348288522/20180808_202031.jpg	0	3
CotA	095	Shaffles	U	Creature	Dis	Imp	0	2	~	At the end of your turn, your opponent loses 1[Æ].	"Do you want imps?  This is how you get imps."	Timur Shevtsov	https://i.imgur.com/9U0K4Rj.jpg	0	15
CotA	096	Shooler	C	Creature	Dis	Demon	0	5	~	Play: If your opponent has 4[Æ] or more, steal 1[Æ].	"Demons onle take, never give." -- The Sanctified Scroll	Grigory Serov	https://www.facebook.com/photo.php?fbid=10214925319739349&set=oa.505644606563646&type=3&theater	0	36
CotA	097	Snudge	U	Creature	Dis	Demon	0	4	~	Fight/Reap:  Return an artifact or flank creature to its owner's hand.	It's only sensible to fear the dark.	Eric Kenji Aoyagi	https://www.facebook.com/photo.php?fbid=310151819557375&set=pcb.512241152570658&type=3&theater&ifg=1	0	6
CotA	098	Stealer of Souls	U	Creature	Dis	Demon	0	6	~	After an enemy creature is destroyed fighting Stealer of Souls, purge that creature and gain 1[Æ]. (A purged creature is removed from the game.)		Jorge Ramos	https://www.facebook.com/photo.php?fbid=1651196818324840&set=oa.505644606563646&type=3&theater	0	19
